1000;	Шекснинский	маслозавод;Продукция пользуется большим спросом и признана не только покупателями Вологодской области,  но и покупателями других городов Северо-Западного региона России, в том числе г. Санкт-Петербурга и г. Мурманска. Надежность, партнерство,	стабильность поставок, расширение ассортимента, хорошее качество продукции, современная	упаковка и дизайн обеспечивают продукции ПК «Шекснинский маслозавод» заслуженное уважение	покупателей	и	конкурентоспособность	на	рынке.Вырабатываемая	продукция:	молоко,	сливки,	сметана,	творог,	кефир,	«Ряженка»,	«Снежок»,	масло	коровье	сливочное	«Традиционное»,	«Крестьянское».	Сливочное	масло	-	гордость	и	марка	предприятия.	Выпускаемое	«Традиционное»	и	«Крестьянское»	масло	имеет	отличный	вкус	и	высокое	качество.	Продукт	вырабатывается	из	отборного молока и сливок	по старым	традициям Вологодского маслоделия.;http://sheksnamaslo.ru/resources/main/img/logo.png;http://sheksnamaslo.ru/
2000;	Вологодский молочный комбинат;Благодаря  тому, что вся  выпускаемая  продукция (а это более 50 наименований) изготавливается из  натурального  сырья  высокого   качества  без  добавления	консервантов, ее  любят и знают не  только  в  областном  центре,	но и  далеко за  ее  пределами. В 2013 году Вологодский молочный комбинат отпраздновал	своё 80-летие.;http://vmkmilk.ru/sites/all/themes/vmk/images/logo.png;http://vmkmilk.ru/
3000;	Шекснахлеб;;
4000;	Вологодская кондитерская фабрика;"Кондитерская фабрика города Вологды является одним из крупнейших производителей сладостей на Северо-западе. Направление деятельности: производство кондитерских изделий, оптовая и розничная торговля. Предприятие успешно развивается, с каждым годом наращивая объемы производства и увеличивая ассортимент продукции, который насчитывает около 300 наименований: зефир, мармелад, пастила, карамель, драже, конфеты, ирис, желе и сувенирная продукция из шоколада.;При производстве сладостей ЗАО «Кондитерская фабрика» использует натуральные дары природы Вологодчины: бруснику, чернику, клюкву, шиповник, рябину, свеклу, кабачки, морковь. Предприятие выпускает продукцию профилактического, диетического назначения: с добавлением морской капусты, витамина С, натуральных масел и изделия без сахара. Ассортимент сертифицирован по системе «Настоящий вологодский продукт», что гарантирует высочайшее качество выпускаемой продукции. За годы работы на рынке кондитерская фабрика зарекомендовало себя как преуспевающая компания, и ее сотрудники гордятся тем, что обеспечивают покупателей вкусной продукцией высокого качества. ЗАО «Кондитерская фабрика» награждена золотыми и серебряными медалями, многочисленными дипломами межотраслевых, межрегиональных и международных выставок. Зефир, мармелад и конфеты – победители в номинации «100 лучших товаров России». <br/>По итогам 2010 года Вологодская кондитерская фабрика получила звание «Лучшее малое предприятие в сфере производства потребительской продукции» в России, в 2011 фабрика стала победителем соревнований в агропромышленном комплексе Вологодской области.";;http://www.sladosti35.ru/
5000;	Кондитерская фабрика «АтАг»; Узнать шекснинские конфеты можно не только по настоящему шоколадному вкусу и запаху, но и по очень красочной, оригинальной упаковке. По мнению специалистов в области потребительского дизайна, шекснинская «одежда» для конфет – сейчас одна из самых интересных на всем постсоветском пространстве. На сегодняшний день ассортимент составляет более 100 наименований шоколадных драже и конфет с различными начинками. И ежегодно увеличивается на 15-20 позиций.<br/>Знаете, что отличает фирму «АтАг»? Постоянное обновление ассортимента! На «заре» своего создания в 1997 году здесь делали мармелад, зефир, пекли десятки сортов печения.  И каждый год что-то менялось – одни виды продукции исчезали, другие появлялись и быстро становились популярными у любителей сладостей. Если говорить о дне сегодняшнем, то руководители кондитерского производства сделали ставку на изготовление конфет. В их изготовлении не используются искуственные  добавки! Это тоже наш ответ на требование времени: люди ходят есть натуральные  и качественные продукты;;http://atag-sheksna.ru
6000;	Сухонский молочный комбинат;ООО «Сухонский молочный комбинат» (г. Сокол) Сухонский молочный комбинат, расположенный на берегу реки Сухоны, что в Вологодской области — одно из старейших предприятий отрасли, вот уже более 80 лет оно радует российского потребителя своей продукцией.
7000;	Масложировая компания г. Череповец;	Майонез, томатные и майонезные соусы, растительные масла под тороговой маркой *Золотая мечта*,	мясные консервы под торговой маркой *Вологодский стандарт*;;http://www.zolotayamechta.ru/
8000;     Тарногский маслозавод